{
  "changeKind": "CONSENT",
  "principalRef": "PRN-AG01",
  "authorityVersion": 90420,
  "consentRecord": {
    "clientEntityRef": "ENT-CL0042",
    "state": "WITHDRAWN",
    "scopeItems": ["submission", "document.read"],
    "validFrom": "2026-11-01T00:00:00Z",
    "validUntil": "2027-03-31T23:59:59Z"
  }
}
