{
  "changeKind": "GRANT",
  "principalRef": "PRN-8C41",
  "authorityVersion": 90412,
  "grantRecord": {
    "entityRef": "ENT-3F2A9C",
    "grants": [
      {
        "action": "document.read",
        "scopeLevel": "ENTITY_PERIOD",
        "scopeRef": "ENT-3F2A9C",
        "periodFrom": "2027-01-01",
        "periodTo": "2027-06-30",
        "periodRefs": ["2027-Q1", "2027-Q2"],
        "validFrom": "2027-01-15T00:00:00Z",
        "validUntil": "2027-09-30T23:59:59Z"
      },
      {
        "action": "document.read",
        "scopeLevel": "TENANT",
        "scopeRef": "TEN-7B1004",
        "validFrom": "2026-11-01T00:00:00Z"
      }
    ]
  }
}
